url,type,text,imgs,author,time,location,author_id
https://www.douban.com/group/topic/298373608/,正文,谢谢大家！都好热心啊给我留言好多条，社恐的我表示受宠若惊。就不一一回复了，有空我会再尝试，成功了再给大家说，谢谢！😆,,阿白,2023-11-27 20:37:03,贵州,221952798
https://www.douban.com/group/topic/298373608/,评论,先倒白酒杀菌重新再腌一次试试。话说四川这边做这玩意儿好像都是水腌法，而且不切碎的。,,cbl,2023-11-27 21:26:51,四川,2672383
https://www.douban.com/group/topic/298373608/,评论,水腌那种不下5次，要不太咸，要不烂了，觉得太浪费食材，所以很长时间没有做。然后直到有一天刷到了这种切碎腌豇豆的方法，决定再试一次，结果…,,阿白,2023-11-27 21:31:13,贵州,221952798
https://www.douban.com/group/topic/298373608/,评论,我的豇豆啊！！！你那么新鲜，那么嫩，又被糟蹋了🤧,,阿白,2023-11-27 21:32:35,贵州,221952798
https://www.douban.com/group/topic/298373608/,评论,"好神奇。玻璃坛子，大概一斤凉白开二两泡菜盐，加白酒糖芹菜杆子姜蒜，菜洗净晾干或者用开水烫过，码入坛子，有条件加母水或者袋装野山椒，背阴通风处，定时检查是否有生花混浊，泡到豇豆变黄即成。
全程戒生水油腻，会变质。手要洗净不要有汗，没把握就用筷子代替。",,cbl,2023-11-27 21:40:23,四川,2672383
https://www.douban.com/group/topic/298373608/,评论,可能破案了，我用手抓的…,,阿白,2023-11-27 21:44:08,贵州,221952798
https://www.douban.com/group/topic/298373608/,评论,在泡菜坛加竹笋，不会长花花,,黑家仑,2023-11-27 21:54:50,四川,225500562
https://www.douban.com/group/topic/298373608/,评论,我今天刚泡的，你把罐子用白酒消杀一遍，无油无水，菜也是，放水就放凉白开。,https://img9.doubanio.com/view/richtext/large/public/p638795094.jpg,学习使我快乐,2023-11-27 21:58:33,安徽,239633074
https://www.douban.com/group/topic/298373608/,评论,楼主试试我的办法，这是我腌的酸菜,https://img1.doubanio.com/view/richtext/large/public/p638796180.jpg,半生笛,2023-11-27 22:01:08,浙江,145235941
https://www.douban.com/group/topic/298373608/,评论,你试试看小高姐的视频？她也发过腌制品,,何以知止,2023-11-27 22:25:59,山东,66951693
https://www.douban.com/group/topic/298373608/,评论,酸芥菜嘛,https://img1.doubanio.com/view/richtext/s/public/p638796180.jpg,茶十,2023-11-27 22:40:39,江苏,198832844
https://www.douban.com/group/topic/298373608/,评论,我觉得是温度现在比较低了 夏天做很容易成功,,锦鲤,2023-11-27 22:41:45,吉林,159643620
https://www.douban.com/group/topic/298373608/,评论,这个咋做的 想吃酸菜鱼,https://img1.doubanio.com/view/richtext/s/public/p638796180.jpg,锦鲤,2023-11-27 22:43:17,吉林,159643620
https://www.douban.com/group/topic/298373608/,评论,是的,,半生笛,2023-11-27 22:44:00,浙江,145235941
https://www.douban.com/group/topic/298373608/,评论,放点白酒加点盐，注意保持干净！,,乐妈,2023-11-27 22:46:38,陕西,233618112
https://www.douban.com/group/topic/298373608/,评论,没看到教程呀，我之前在直播间中过一袋芥菜种子，种了长好大，炒着吃煮汤吃着有点苦，我看教程用淘米水做了酸菜，玻璃瓶装的现在看变黄了但还没尝酸不酸，你是怎么做的？酸味适中吗？,,茶十,2023-11-27 22:48:53,江苏,198832844
https://www.douban.com/group/topic/298373608/,评论,不要急，我还没写呢,,半生笛,2023-11-27 22:49:57,浙江,145235941
https://www.douban.com/group/topic/298373608/,评论,酸豆角要整根腌，放水放盐就行了，水一定要超过豆角，可以拿个石头压住（我妈直接用的干净稻草），我家每年都做，成功率还蛮高的,,明朗之夏,2023-11-27 22:56:10,湖南,41086112
https://www.douban.com/group/topic/298373608/,评论,"我想学着腌，看了好多教程，但是还是没有勇气。
楼主成功后记得来发帖教一下我。
实践是检验方法的唯一标准，你是行动派。",,拖延症治疗院,2023-11-27 23:01:14,北京,dandelionj
https://www.douban.com/group/topic/298373608/,评论,"买回来新鲜的芥菜，洗净晾晒1~2天（
干一点不要紧，不能太潮湿），锅内水烧开后，芥菜下锅烫1-2分钟即可（要叶子和梗全部浸入滚水中），菜和锅里的水一起找合适的容器盛出，叶子和梗要刚好都能泡在水里，加入少量食盐，适量白醋用盖子稍微盖一下（不需要密封），3-5天就可以食用。
注意事项：芥菜洗净后一定要晾干再下锅煮，这样芥菜水分减少纤维韧性增加，下锅煮和泡久一点都不容易烂，少量食盐和适量白醋，可以增加风味，防止细菌滋生，食盐和白醋的量少一点没关系，烹饪的时候可以再加，建议烹饪的时候加一点白糖和蚝油，味道层次更丰富",https://img1.doubanio.com/view/richtext/s/public/p638796180.jpg,半生笛,2023-11-27 23:04:32,浙江,145235941
https://www.douban.com/group/topic/298373608/,评论,新手一定不能用手！！！每个人的手皮肤菌群不同。有的人随便怎么抓都没事。有的人稍微碰到就会生花。,,monica,2023-11-27 23:34:13,云南,59961079
https://www.douban.com/group/topic/298373608/,评论,要用盐腌一下  把水倒干   在腌,,momo,2023-11-27 23:38:22,贵州,226456909
https://www.douban.com/group/topic/298373608/,评论,我的也是，我把白花捞出来，今天加了点白酒，明天看看，不行就倒了,,豆角子,2023-11-28 00:00:28,北京,25546422
https://www.douban.com/group/topic/298373608/,评论,哈哈哈你在cpu我吗😂,,阿白,2023-11-28 09:39:04,贵州,221952798
https://www.douban.com/group/topic/298373608/,评论,谢谢亲回复这么多。这种方法，和我妈妈做的无盐酸菜方法很像，我做过两次，一次成功一次失败，我这边天气冷就不太容易成功。,,阿白,2023-11-28 09:41:14,贵州,221952798
https://www.douban.com/group/topic/298373608/,评论,谢谢亲提醒，我以前完全没想过手的问题,,阿白,2023-11-28 09:42:05,贵州,221952798
https://www.douban.com/group/topic/298373608/,评论,我好心痛😭！精心挑选的两把嫩豇豆，怀着非常虔诚的态度，一步一步按照别人配方做的，最后长花了…我接受不了…,,阿白,2023-11-28 09:44:14,贵州,221952798
https://www.douban.com/group/topic/298373608/,评论,我喜欢吃这个，但是不会腌，楼里的有没有推荐哪里卖的好吃？,,I,2023-11-28 09:45:57,江苏,4365744
https://www.douban.com/group/topic/298373608/,评论,好的,,阿白,2023-11-28 09:52:32,贵州,221952798
https://www.douban.com/group/topic/298373608/,评论,不客气，这种做法比较简单，很容易成功，偏腌泡菜的做法，如果要加大量盐的那种发酵时间比较长，操作复杂一些，偏腌咸菜的做法,https://img2.doubanio.com/view/richtext/large/public/p638943792.jpg,半生笛,2023-11-28 10:05:36,浙江,145235941
https://www.douban.com/group/topic/298373608/,评论,我在支持你继续尝试。,,拖延症治疗院,2023-11-28 10:08:35,北京,dandelionj
https://www.douban.com/group/topic/298373608/,评论,今天又长了，我丢掉了。,,豆角子,2023-11-28 13:06:58,北京,25546422
https://www.douban.com/group/topic/298373608/,评论,我用的自来水腌的，黄黄的也挺好吃，脆。照片是第三拨水了所以有点浑,https://img2.doubanio.com/view/richtext/large/public/p639017942.jpg,霏非雨,2023-11-28 13:15:11,广东,235600135
https://www.douban.com/group/topic/298373608/,评论,这玩意怎么会失败，感觉随便洗洗切了放点盐就能成🤣……夏天做了放在现在还挺好,,吃不胖的有钱花,2023-11-28 13:17:05,湖北,221202421
https://www.douban.com/group/topic/298373608/,评论,这种应该是最简单的酸豆角做法了吧，失败率很低的，是不是盐放少了，下次再试试,,阳光肥宅,2023-11-28 16:23:48,天津,41771352
https://www.douban.com/group/topic/298373608/,评论,一定要无油，所有接触到的东西不能有油，我开始以为还要无水，后来看到一个姐姐说有一点水也没事的，我就做了好几瓶，都很成功,,阳光肥宅,2023-11-28 16:25:18,天津,41771352
https://www.douban.com/group/topic/298373608/,评论,这个怎么会失败？,,豆友172353460,2023-11-28 22:15:08,广西,172353460
https://www.douban.com/group/topic/298373608/,评论,我这边的，就是把它洗干净，晾干要无水，然后切放盐，放辣椒，放蒜米拌放盖子，焖它5~6天就可以吃了。,,豆友172353460,2023-11-28 22:15:42,广西,172353460
https://www.douban.com/group/topic/298373608/,评论,我说的方法是腌好之后可以直接生吃的。,,豆友172353460,2023-11-28 22:17:00,广西,172353460
https://www.douban.com/group/topic/298373608/,评论,瓶子和豆角都要晾干，然后再切了装瓶。应该很简单的。可能是不是有水汽影响了。,,荔枝雅,2023-11-29 17:20:13,广东,orchidya
https://www.douban.com/group/topic/298373608/,评论,我用淘米水发酵的方法腌过，是成功的,,momo,2023-11-30 08:04:35,广东,sunkiss_w
https://www.douban.com/group/topic/298373608/,评论,我泡酸豆角每次都能成功，重要的是消毒，盐多一点，加水没过食材，密封！密封很重要。我用泡菜坛子水封的,,徐徐而图之之,2023-11-30 15:34:55,湖北,83681026
https://www.douban.com/group/topic/298373608/,评论,加点白糖或者冰糖提供养分，20发酵好，30天风味最好,,徐徐而图之之,2023-11-30 15:35:39,湖北,83681026
https://www.douban.com/group/topic/298373608/,评论,想念我妈腌制的酸豇豆和酸黄瓜了，到我，不会做，以后只会去菜场买了吃😂,,夜猫子,2023-11-30 16:08:41,浙江,nightcatm
